{
  "$schema": "./mod.schema.json",
  "authorDisplay": "MegaPiggy & PacificEngine",
  "downloadCountOffset": 16489,
  "firstReleaseDateOverride": "2021-10-21T06:57:15Z",
  "name": "Cheats Mod",
  "repo": "MegaPiggy/CheatsMod_NoCommonResources",
  "tags": [
    "tool"
  ],
  "uniqueName": "PacificEngine.CheatsMod"
}
