{
  "$schema": "./mod.schema.json",
  "authorDisplay": "Olallieberry - ditzy, MegaPiggy, Xya, Etherpod",
  "name": "Borrowed Tomorrows",
  "parent": "xen.NewHorizons",
  "repo": "Etherpod/Olallieberry",
  "tags": [
    "jam",
    "story",
    "content",
    "gameplay"
  ],
  "uniqueName": "Olallieberry.BorrowedTomorrows"
}
