{
  "$schema": "./mod.schema.json",
  "authorDisplay": "Orbital 32 (a.k.a. cigtu) and members from the discord modding server",
  "name": "i let the voices on the discord server make bad ideas for planets",
  "parent": "xen.NewHorizons",
  "repo": "RealOrbital32/discord",
  "tags": [
    "content"
  ],
  "uniqueName": "O32.Discord"
}
