{
  "$schema": "./mod.schema.json",
  "authorDisplay": "xen",
  "name": "New Horizons Examples",
  "parent": "xen.NewHorizons",
  "repo": "Outer-Wilds-New-Horizons/nh-examples",
  "repoVariations": [
    "xen-42/ow-new-horizons-examples"
  ],
  "tags": [
    "content",
    "requires-dlc"
  ],
  "uniqueName": "xen.NewHorizonsExamples"
}
