{
  "$schema": "./mod.schema.json",
  "alpha": true,
  "authorDisplay": "Locochoco & MegaPiggy",
  "name": "OWAML",
  "repo": "ow-mods/owaml",
  "repoVariations": [
    "ShoosGun/OWAML",
    "loco-choco/OWAML"
  ],
  "required": true,
  "tags": [
    "library"
  ],
  "uniqueName": "Locochoco.OWAML",
  "utility": true
}
