{
  "$schema": "./mod.schema.json",
  "authorDisplay": "Can't Afford a Name",
  "name": "Tesseract's Secret",
  "parent": "xen.NewHorizons",
  "repo": "CantAffordaName/CantAffordaName.TesseractsSecret",
  "tags": [
    "jam",
    "gameplay",
    "story",
    "requires-dlc"
  ],
  "uniqueName": "CantAffordaName.TesseractsSecret"
}
