{
  "$schema": "./mod.schema.json",
  "name": "Overslept",
  "repo": "Point7651/OverSlept",
  "tags": [
    "tweaks"
  ],
  "thumbnailUrl": "https://private-user-images.githubusercontent.com/144411884/455148263-6e682f95-6740-4fdc-9774-8cecbe5d408c.png?jwt=eyJhbGciOiJIUzI1NiIsInR5cCI6IkpXVCJ9.eyJpc3MiOiJnaXRodWIuY29tIiwiYXVkIjoicmF3LmdpdGh1YnVzZXJjb250ZW50LmNvbSIsImtleSI6ImtleTUiLCJleHAiOjE3NDk5MDE4NzYsIm5iZiI6MTc0OTkwMTU3NiwicGF0aCI6Ii8xNDQ0MTE4ODQvNDU1MTQ4MjYzLTZlNjgyZjk1LTY3NDAtNGZkYy05Nzc0LThjZWNiZTVkNDA4Yy5wbmc_WC1BbXotQWxnb3JpdGhtPUFXUzQtSE1BQy1TSEEyNTYmWC1BbXotQ3JlZGVudGlhbD1BS0lBVkNPRFlMU0E1M1BRSzRaQSUyRjIwMjUwNjE0JTJGdXMtZWFzdC0xJTJGczMlMkZhd3M0X3JlcXVlc3QmWC1BbXotRGF0ZT0yMDI1MDYxNFQxMTQ2MTZaJlgtQW16LUV4cGlyZXM9MzAwJlgtQW16LVNpZ25hdHVyZT1mMTJlYzBkYTJhOWZmN2QzYWViNDNlMjk2Y2YxM2FiMDRkZTE1N2RmMWI3NTkyNzI2N2M5YmU4YWNiOGViOGJkJlgtQW16LVNpZ25lZEhlYWRlcnM9aG9zdCJ9.a8qnS2vRQjkE-oXTmkq1k9zNRuf7hseCDG0Kavchq0U",
  "uniqueName": "Point7651.OverSlept"
}
