{
  "$schema": "./mod.schema.json",
  "name": "Outer Wilds Greek Translation",
  "repo": "DimitriosNossis/Outer-Wilds-Greek-Translation",
  "tags": [
    "localization"
  ],
  "thumbnailUrl": "https://github.com/DimitriosNossis/Outer-Wilds-Greek-Translation/blob/main/outer%20wilds%20greek%20translation3-1.png",
  "uniqueName": "Dimitrios.GreekTranslation"
}
