{
  "$schema": "./mod.schema.json",
  "authorDisplay": "pikpik_carrot, shoe, Texture Turtle, Toxic",
  "name": "Iceolation",
  "parent": "xen.NewHorizons",
  "repo": "pikpik-carrot/2024FallJam",
  "tags": [
    "jam",
    "story"
  ],
  "uniqueName": "pikpik_carrot,shoe,TextureTurtle.2024FallJam"
}
