{
  "$schema": "./mod.schema.json",
  "name": "The Hearthian Parable",
  "repo": "Vambok/HearthianParable",
  "tags": [
    "jam",
    "story",
    "audiovisual"
  ],
  "thumbnailUrl": "https://raw.githubusercontent.com/Vambok/HearthianParable/refs/heads/main/error.png",
  "uniqueName": "Vambok.HearthianParable"
}
