{
  "$schema": "./mod.schema.json",
  "name": "Candy World",
  "parent": "xen.NewHorizons",
  "repo": "CrazyHasNoIdeaWhatToDo/CandyWorld-Outer-Wilds-Mod-",
  "tags": [
    "content"
  ],
  "thumbnailUrl": "https://raw.githubusercontent.com/CrazyHasNoIdeaWhatToDo/CandyWorld-Outer-Wilds-Mod-/main/thumbnail.png",
  "uniqueName": "CrazyHasNoIdeaWhatToDo.CandyWorld"
}
