{
  "$schema": "./mod.schema.json",
  "authorDisplay": "depthbomb",
  "name": "Probe Roulette",
  "repo": "depthbomb/OuterWildsProbeRoulette",
  "tags": [
    "gameplay",
    "tweaks"
  ],
  "thumbnailUrl": "https://raw.githubusercontent.com/depthbomb/OuterWildsProbeRoulette/refs/heads/main/art/banner.png",
  "uniqueName": "Depthbomb.ProbeRoulette"
}
