{
  "$schema": "./mod.schema.json",
  "authorDisplay": "Locochoco & FunkyShoeMan",
  "name": "Kerbal Space Ventures",
  "parent": "Locochoco.SlateShipyard",
  "repo": "loco-choco/Kerbal-Space-Ventures",
  "repoVariations": [
    "ShoosGun/Kerbal-Space-Ventures"
  ],
  "tags": [
    "gameplay",
    "tool"
  ],
  "uniqueName": "Locochoco.KSPShips"
}
