{
  "$schema": "./mod.schema.json",
  "authorDisplay": "pikpik_carrot, Etherpod, Ditzy, TheHipOne",
  "name": "Band Together",
  "parent": "xen.NewHorizons",
  "repo": "Etherpod/Band-Together",
  "tags": [
    "jam",
    "content",
    "story",
    "requires-dlc"
  ],
  "uniqueName": "pikpik_carrot.BandTogether"
}
