{
  "$schema": "./mod.schema.json",
  "authorDisplay": "xen, Bwc9876, JohnCorby, MegaPiggy, and friends",
  "name": "New Horizons",
  "repo": "Outer-Wilds-New-Horizons/new-horizons",
  "repoVariations": [
    "xen-42/outer-wilds-new-horizons"
  ],
  "tags": [
    "tool",
    "content",
    "story"
  ],
  "uniqueName": "xen.NewHorizons"
}
