{
  "$schema": "./mod.schema.json",
  "authorDisplay": "Hamstry",
  "name": "The Longer They Load",
  "parent": "AnonymousStrangerOW.TheStrangerTheyAre",
  "repo": "Hamstryk/The-Longer-They-Load",
  "tags": [
    "gameplay",
    "requires-dlc"
  ],
  "thumbnailUrl": "https://raw.githubusercontent.com/Hamstryk/The-Longer-They-Load/refs/heads/main/TSTAButGood/owmm_img.png",
  "uniqueName": "Hamstry.TheLongerTheyLoad"
}
